{
  "observationId": "mer_obs_000000001",
  "schemaVersion": "1.1",
  "atlasProductId": "ram_corsair_cmk32gx5m2b6000z30",
  "retailerId": "RETAILER-0001",
  "marketplace": "amazon.com",
  "observationTime": "2026-07-15T20:30:00Z",
  "sourceMethod": "MANUAL",
  "lifecycleStatus": "RETRIEVED",
  "validationStatus": "PASS",
  "supersedesObservationId": null,
  "expiresAt": null,
  "offer": {
    "price": 509.99,
    "currency": "USD",
    "availability": "IN_STOCK",
    "condition": "NEW",
    "sellerType": "RETAILER",
    "sourceUrl": "https://www.amazon.com/dp/B0CBRJ63RT",
    "shipping": {
      "costKnown": true,
      "cost": 0,
      "currency": "USD",
      "notes": "Free Amazon Prime delivery displayed. Amazon.com was both shipper and seller."
    },
    "discount": {
      "originalPrice": 588.99,
      "amount": 79,
      "percentage": 13,
      "label": "13% off"
    },
    "affiliate": {
      "isAffiliateLink": false,
      "network": null,
      "trackingCodePresent": false
    }
  },
  "provenance": {
    "schemaVersion": "1.0",
    "source": {
      "name": "Amazon product detail page",
      "uri": "https://www.amazon.com/dp/B0CBRJ63RT",
      "marketplace": "amazon.com"
    },
    "acquisition": {
      "method": "MANUAL",
      "retrievedAt": "2026-07-15T20:30:00Z",
      "retrievedBy": "human:clinton",
      "requestId": null,
      "rawPayloadReference": null
    },
    "transformation": {
      "adapterId": "mer_adapter_amazon_us",
      "adapterVersion": "manual-1.0",
      "normalizedAt": "2026-07-15T20:30:00Z"
    },
    "validation": {
      "validatorVersion": "mercury-observation-validator-1.0.0",
      "complianceRuleSetVersion": "sentinel-mercury-draft-0.1"
    }
  },
  "compliance": {
    "licenseContext": "MANUAL_PUBLIC_PAGE_OBSERVATION",
    "requiredDisclosureShown": false,
    "requiredPriceDisclaimerShown": false,
    "retailerContentDisclaimerShown": false
  },
  "metadata": {
    "createdAt": "2026-08-03T00:00:00Z",
    "createdBy": "migration:ic-mercury-001",
    "observationHash": null,
    "notes": "First canonical Mercury observation migrated from PRICE-20260715-000001. Publication compliance is evaluated separately by Sentinel and Forge."
  }
}
